{"$schema":"https://json-schema.org/draft/2020-12/schema","additionalProperties":false,"properties":{"authority_id":{"minLength":1,"type":"string"},"authority_type":{"const":"comparison_authority"},"comparator_git_blob":{"pattern":"^[0-9a-f]{40}$","type":"string"},"comparator_identity":{"minLength":1,"type":"string"},"comparator_interface_version":{"const":"RANDLE-R4-COMPARATOR-1"},"comparator_raw_sha256":{"pattern":"^[0-9a-f]{64}$","type":"string"},"result_schema_role":{"const":"terminal_comparison_receipt_schema"},"schema_version":{"const":"6.0.0-DRAFT"}},"required":["authority_id","authority_type","comparator_git_blob","comparator_identity","comparator_interface_version","comparator_raw_sha256","result_schema_role","schema_version"],"title":"R4 comparator authority","type":"object"}
