{"authority_id":"RANDLE-R4-COMPARISON-AUTHORITY-1","authority_type":"comparison_authority","comparator_git_blob":"f3b42359d4316e34db4664818940cac918bbeacf","comparator_identity":"RANDLE-R4-INDEPENDENT-COMPARATOR-1","comparator_interface_version":"RANDLE-R4-COMPARATOR-1","comparator_raw_sha256":"c17572c50667150850ebc29bbb3ab18395e4945da1635f149cf9cb8c605f11e1","result_schema_role":"terminal_comparison_receipt_schema","schema_version":"6.0.0-DRAFT"}
